[
  {
    "id": "vercel",
    "name": "Vercel",
    "category": "hosting",
    "description": "Static and serverless hosting with preview deployments per branch and AI Gateway included.",
    "free_limit": "Hobby: 100GB bandwidth/mo, 100h serverless, $5/mo AI credit",
    "requires_card": false,
    "cold_start_risk": "low",
    "url": "https://vercel.com",
    "tags": [
      "deploy",
      "edge",
      "serverless",
      "nextjs",
      "essential"
    ],
    "verified": "2026-09-24",
    "verified_by": "@seed-import",
    "status": "active",
    "notes": "Hobby is explicitly non-commercial. Fine for a side project, against ToS for a paid product."
  },
  {
    "id": "netlify",
    "name": "Netlify",
    "category": "hosting",
    "description": "Static hosting, edge functions and form handling with per-branch deploy previews.",
    "free_limit": "100GB bandwidth/mo, 300 build minutes/mo",
    "requires_card": false,
    "cold_start_risk": "low",
    "url": "https://netlify.com",
    "tags": [
      "deploy",
      "static",
      "edge"
    ],
    "verified": "2026-09-24",
    "verified_by": "@seed-import",
    "status": "active"
  },
  {
    "id": "cloudflare-pages",
    "name": "Cloudflare Pages",
    "category": "hosting",
    "description": "Unlimited-bandwidth static hosting that pairs with Workers, D1 and R2 on the same free account.",
    "free_limit": "Unlimited requests and bandwidth; 500 builds/month",
    "requires_card": false,
    "cold_start_risk": "low",
    "url": "https://pages.cloudflare.com",
    "tags": [
      "deploy",
      "static",
      "unlimited-bandwidth",
      "essential"
    ],
    "verified": "2026-09-24",
    "verified_by": "@seed-import",
    "status": "active",
    "notes": "The best free host for this site's own architecture: static output, no egress billing, global CDN."
  },
  {
    "id": "cloudflare-workers",
    "name": "Cloudflare Workers",
    "category": "compute",
    "description": "V8-isolate serverless functions with cron triggers and durable objects, plus a free Workers AI binding.",
    "free_limit": "100,000 requests/day, 10ms CPU per request",
    "requires_card": false,
    "cold_start_risk": "low",
    "url": "https://workers.cloudflare.com",
    "tags": [
      "serverless",
      "edge",
      "cron",
      "essential"
    ],
    "verified": "2026-09-24",
    "verified_by": "@seed-import",
    "status": "active",
    "notes": "The free tier's 10ms CPU limit is generous for API orchestration and tight for anything doing real compute."
  },
  {
    "id": "github-pages",
    "name": "GitHub Pages",
    "category": "hosting",
    "description": "Static hosting straight from a repository, with a custom domain and HTTPS included.",
    "free_limit": "1GB site size, 100GB/mo soft bandwidth, 10 builds/hour",
    "requires_card": false,
    "cold_start_risk": "low",
    "url": "https://pages.github.com",
    "tags": [
      "deploy",
      "static",
      "github",
      "zero-config"
    ],
    "verified": "2026-09-24",
    "verified_by": "@seed-import",
    "status": "active"
  },
  {
    "id": "render",
    "name": "Render",
    "category": "hosting",
    "description": "Container and web-service hosting with managed Postgres and cron jobs.",
    "free_limit": "750 instance-hours/mo; services spin down after 15 min idle",
    "requires_card": false,
    "cold_start_risk": "high",
    "url": "https://render.com",
    "tags": [
      "deploy",
      "containers",
      "cold-starts"
    ],
    "verified": "2026-09-24",
    "verified_by": "@seed-import",
    "status": "active",
    "notes": "The 15-minute spin-down makes cold starts of 30-60s. Fine for demos, painful for a live agent endpoint."
  },
  {
    "id": "railway",
    "name": "Railway",
    "category": "hosting",
    "description": "Fast deploys from a repo or Dockerfile with databases attached, billed by usage.",
    "free_limit": "Trial credits on signup; $5/mo Hobby credit afterwards",
    "requires_card": true,
    "cold_start_risk": "low",
    "url": "https://railway.com",
    "tags": [
      "deploy",
      "containers",
      "databases"
    ],
    "verified": "2026-09-24",
    "verified_by": "@seed-import",
    "status": "active"
  },
  {
    "id": "fly-io",
    "name": "Fly.io",
    "category": "hosting",
    "description": "Runs Docker containers close to users with persistent volumes and private networking.",
    "free_limit": "Limited free VM allowance for small machines (no managed databases)",
    "requires_card": true,
    "cold_start_risk": "low",
    "url": "https://fly.io",
    "tags": [
      "deploy",
      "containers",
      "global",
      "volumes"
    ],
    "verified": "2026-09-24",
    "verified_by": "@seed-import",
    "status": "active"
  },
  {
    "id": "koyeb",
    "name": "Koyeb",
    "category": "hosting",
    "description": "Serverless container platform with a small always-on free instance and GPU options.",
    "free_limit": "One free web service instance (0.1 vCPU / 512MB)",
    "requires_card": false,
    "cold_start_risk": "medium",
    "url": "https://koyeb.com",
    "tags": [
      "deploy",
      "containers",
      "always-on"
    ],
    "verified": "2026-09-24",
    "verified_by": "@seed-import",
    "status": "active"
  },
  {
    "id": "deno-deploy",
    "name": "Deno Deploy",
    "category": "compute",
    "description": "Edge TypeScript runtime with KV storage, queues and cron built in — no build step.",
    "free_limit": "1M requests/mo, 100GB bandwidth/mo",
    "requires_card": false,
    "cold_start_risk": "low",
    "url": "https://deno.com/deploy",
    "tags": [
      "serverless",
      "edge",
      "typescript",
      "kv"
    ],
    "verified": "2026-09-24",
    "verified_by": "@seed-import",
    "status": "active"
  },
  {
    "id": "oracle-cloud-always-free",
    "name": "Oracle Cloud Always Free",
    "category": "compute",
    "description": "The only major cloud with a permanently free ARM VM generous enough to self-host several services.",
    "free_limit": "4 ARM cores + 24GB RAM, 200GB storage, 10TB egress/mo, forever",
    "requires_card": true,
    "cold_start_risk": "low",
    "url": "https://www.oracle.com/cloud/free/",
    "tags": [
      "vm",
      "always-free",
      "self-host",
      "arm",
      "essential"
    ],
    "verified": "2026-09-24",
    "verified_by": "@seed-import",
    "status": "active",
    "notes": "Capacity in popular regions is often exhausted — retry or pick another home region. Card required for verification but not charged."
  },
  {
    "id": "aws-free-tier",
    "name": "AWS Free Tier",
    "category": "compute",
    "description": "Twelve months of t4g.small, Lambda allowances and 5GB S3, plus always-free Lambda and DynamoDB caps.",
    "free_limit": "12-month credits for new accounts; perpetual Lambda/DynamoDB allowances",
    "requires_card": true,
    "cold_start_risk": "low",
    "url": "https://aws.amazon.com/free/",
    "tags": [
      "cloud",
      "aws",
      "credits"
    ],
    "verified": "2026-09-24",
    "verified_by": "@seed-import",
    "status": "active"
  },
  {
    "id": "gcp-free-tier",
    "name": "Google Cloud Free Tier",
    "category": "compute",
    "description": "e2-micro VM, Cloud Run and Firestore allowances, plus the $300 new-account credit.",
    "free_limit": "Always-free e2-micro VM + Cloud Run/Speech/BigQuery monthly quotas",
    "requires_card": true,
    "cold_start_risk": "low",
    "url": "https://cloud.google.com/free",
    "tags": [
      "cloud",
      "gcp",
      "always-free"
    ],
    "verified": "2026-09-24",
    "verified_by": "@seed-import",
    "status": "active"
  },
  {
    "id": "huggingface-spaces",
    "name": "Hugging Face Spaces",
    "category": "compute",
    "description": "Free CPU containers for hosting Gradio or Docker demos, with permanent public URLs.",
    "free_limit": "2 vCPU / 16GB RAM free CPU Spaces (sleep after inactivity on some configs)",
    "requires_card": false,
    "cold_start_risk": "medium",
    "url": "https://huggingface.co/spaces",
    "tags": [
      "demos",
      "gradio",
      "docker",
      "ml"
    ],
    "verified": "2026-09-24",
    "verified_by": "@seed-import",
    "status": "active",
    "notes": "Best free way to put a public demo of your agent in front of people."
  },
  {
    "id": "google-colab",
    "name": "Google Colab",
    "category": "compute",
    "description": "Free hosted Jupyter with a T4 GPU — the cheapest path to fine-tuning or running a large model.",
    "free_limit": "Free GPU sessions (T4), subject to availability and session limits",
    "requires_card": false,
    "cold_start_risk": "high",
    "url": "https://colab.research.google.com",
    "tags": [
      "gpu",
      "notebooks",
      "fine-tuning",
      "free-gpu"
    ],
    "verified": "2026-09-24",
    "verified_by": "@seed-import",
    "status": "active",
    "notes": "Free GPU availability is not guaranteed at peak times and sessions die after idle periods — not a deploy target."
  },
  {
    "id": "kaggle-notebooks",
    "name": "Kaggle Notebooks",
    "category": "compute",
    "description": "Free GPU/TPU notebooks with 30 hours of weekly GPU quota and persistent datasets.",
    "free_limit": "30 GPU hours/week (P100 or T4x2), 20 TPU hours/week",
    "requires_card": false,
    "cold_start_risk": "medium",
    "url": "https://www.kaggle.com/docs/notebooks",
    "tags": [
      "gpu",
      "tpu",
      "notebooks",
      "fine-tuning"
    ],
    "verified": "2026-09-24",
    "verified_by": "@seed-import",
    "status": "active"
  },
  {
    "id": "modal",
    "name": "Modal",
    "category": "compute",
    "description": "Serverless Python with GPU-per-second billing — good for embedding jobs and batch inference.",
    "free_limit": "$30/month of included compute on the free plan",
    "requires_card": false,
    "cold_start_risk": "medium",
    "url": "https://modal.com",
    "tags": [
      "gpu",